<?xml version="1.0" encoding="UTF-8"?>
<!DOCTYPE projectRecord SYSTEM "PR.dtd">
<projectRecord>
    <title>Project Record</title>
    <data>
        <key_name>TP2</key_name>
        <title>Servidor NodeJS e Indice XSL</title>
        <subtitle>Trabalho de casa 4</subtitle>
        <begin_date>02/11/2020</begin_date>
        <end_date>09/11/10</end_date>
        <supervisor href="http://www4.di.uminho.pt/~jcr/">José Carlos Ramalho</supervisor>
    </data>
    <team>
        <element>
            <name>Bernardo Viseu</name>
            <email>a74618@alunos.uminho.pt</email>
        </element>
    </team>
    <abstract>
        <paragraph>
            <line>Neste projecto foi definido um XSL de maneira a organizar os Arqueossitions do NW portugues, e utilizar um servidor realizado em JS para colocar o resultado HTML num localhost.</line>
        </paragraph>
    </abstract>
    <deliverables>
        <ref href="https://github.com/Pacifico53/PRI2020">Repositório de PRI</ref>
    </deliverables>
</projectRecord>
